{"type":"config","name":"webgpu-production","metricName":"decode_tok_s","metricUnit":"tok/s","bestDirection":"higher"}
{"run":1,"commit":"a8a9007","metric":2.4,"metrics":{"browser_tests_passed":162,"output_coherent":1,"temp_gt0_works":0,"ttft_ms":2793},"status":"keep","description":"baseline: 2.4 tok/s, 162 tests pass, temp>0 untested (demo hardcodes temp=0)","timestamp":1775490288,"segment":0}
{"run":2,"commit":"4eb7c53","metric":2.4,"metrics":{"browser_tests_passed":162,"output_coherent":1,"temp_gt0_works":0,"ttft_ms":2834},"status":"keep","description":"remove ~130 lines diagnostics from mlx-worker.ts (code quality, equal perf)","timestamp":1775490399,"segment":0}
{"run":3,"commit":"253869d","metric":2.5,"metrics":{"browser_tests_passed":162,"output_coherent":1,"temp_gt0_works":1,"ttft_ms":2796},"status":"keep","description":"fix temp>0: pure Rust categorical sampling avoids WASM heap exhaustion","timestamp":1775491602,"segment":0}
{"run":4,"commit":"f4c1d42","metric":2.8,"metrics":{"browser_tests_passed":162,"output_coherent":1,"temp_gt0_works":1,"ttft_ms":2739},"status":"keep","description":"perf: batch size 64→512, setPipeline/setBindGroup dedup (+12%)","timestamp":1775492034,"segment":0}
{"run":5,"commit":"9770666","metric":4.1,"metrics":{"browser_tests_passed":162,"output_coherent":1,"temp_gt0_works":1,"ttft_ms":1585},"status":"keep","description":"fuse setPipeline+setBindGroup+dispatch into single RPC (+46%)","timestamp":1775492458,"segment":0}
{"run":6,"commit":"9770666","metric":3.6,"metrics":{"browser_tests_passed":162,"output_coherent":1,"temp_gt0_works":1,"ttft_ms":2300},"status":"discard","description":"buffer size caching: no improvement, high variance in benchmark","timestamp":1775493086,"segment":0}
{"run":7,"commit":"76c7edf","metric":5.0,"metrics":{"browser_tests_passed":162,"output_coherent":1,"temp_gt0_works":1,"ttft_ms":1159},"status":"keep","description":"reuse compute pass across dispatches, skip begin/end/release RPCs (+22%)","timestamp":1775493707,"segment":0}
{"run":8,"commit":"82018bb","metric":5.4,"metrics":{"browser_tests_passed":162,"output_coherent":1,"temp_gt0_works":1,"ttft_ms":1052},"status":"keep","description":"skip bind group/layout/shader release RPCs (+8%)","timestamp":1775493860,"segment":0}
{"run":9,"commit":"5b909c9","metric":5.5,"metrics":{"browser_tests_passed":162,"output_coherent":1,"temp_gt0_works":1,"ttft_ms":1051},"status":"keep","description":"skip buffer destroy RPC (was already no-op on gpu-worker)","timestamp":1775493939,"segment":0}
{"run":10,"commit":"e47239a","metric":7.2,"metrics":{"browser_tests_passed":162,"output_coherent":1,"temp_gt0_works":1,"ttft_ms":824},"status":"keep","description":"cache buffer sizes with plain object, skip ~71K RPCs (+31%)","timestamp":1775494029,"segment":0}
{"run":11,"commit":"15f1c64","metric":7.4,"metrics":{"browser_tests_passed":162,"output_coherent":1,"temp_gt0_works":1,"ttft_ms":826},"status":"keep","description":"optimize rpcCall hot path, remove debug tracking","timestamp":1775494130,"segment":0}
{"run":12,"commit":"c99ba648","metric":8.0,"metrics":{"browser_tests_passed":159,"output_coherent":1,"temp_gt0_works":1,"ttft_ms":599},"status":"keep","description":"C++ kernel improvements: conv1d, bf16 offset fix, 159/163 tests (+8% tok/s, -27% TTFT)","timestamp":1775516400,"segment":0}
{"run":13,"commit":"673bfa6","metric":null,"metrics":{"browser_tests_passed":159,"output_coherent":null,"temp_gt0_works":null,"ttft_ms":null},"status":"pending","description":"FUSED_SUBMIT: collapse 6 RPCs→1 per encoder submit (pass_end+finish+submit+3 releases). Needs Chrome benchmark.","timestamp":1775602000,"segment":0}
{"run":14,"commit":"52074f7","metric":5.3,"metrics":{"browser_tests_passed":159,"output_coherent":null,"temp_gt0_works":null,"ttft_ms":729},"status":"keep","description":"CREATE_BUFFER_FROM_DATA: fuse createBuffer+writeBuffer into 1 RPC. Uniform buffers 3→1 RPCs/dispatch. Playwright: 5.0→5.3 tok/s (+6%).","timestamp":1775778000,"segment":0}
{"run":15,"commit":"5b2e8ce","metric":6.6,"metrics":{"browser_tests_passed":159,"output_coherent":null,"temp_gt0_works":null,"ttft_ms":626},"status":"keep","description":"FUSED_FULL_DISPATCH: inline bind group creation in dispatch RPC. Eliminates ~100 CREATE_BIND_GROUP RPCs/token. Playwright: 5.3→6.6 tok/s (+25%). TTFT 626ms.","timestamp":1775780000,"segment":0}
{"run":16,"commit":"6f024ec","metric":10.1,"metrics":{"browser_tests_passed":159,"output_coherent":null,"temp_gt0_works":null,"ttft_ms":435},"status":"keep","description":"FUSED_DISPATCH_WITH_UNIFORM: inline writeBuffer in dispatch RPC. 2→1 RPCs per dispatch after warmup. Playwright: 6.6→10.1 tok/s (+53%). TTFT 435ms.","timestamp":1775869200,"segment":0}
{"run":17,"commit":"28d08a9","metric":10.1,"metrics":{"browser_tests_passed":159,"output_coherent":null,"temp_gt0_works":null,"ttft_ms":444},"status":"keep","description":"FUSED_COPY_BUFFER: end pass + copy + begin pass in 1 RPC. No perf gain (copies rare in decode). Correctness improvement only.","timestamp":1775869800,"segment":0}
{"run":18,"commit":"0200159","metric":10.4,"metrics":{"browser_tests_passed":159,"output_coherent":null,"temp_gt0_works":null,"ttft_ms":438},"status":"keep","description":"Optimize rpcCall hot path: Uint32Array direct indexing + explicit params (no array alloc). ~3% improvement.","timestamp":1775870400,"segment":0}
{"run":19,"commit":"0200159","metric":10.8,"metrics":{"browser_tests_passed":159,"output_coherent":null,"temp_gt0_works":null,"ttft_ms":443},"status":"keep","description":"gpu-worker Uint32Array reads: replace DataView with cmdU32 for arg readers, result setters, entry reads in FUSED_FULL_DISPATCH/FUSED_DISPATCH_WITH_UNIFORM. Playwright: 10.4→10.8 tok/s.","timestamp":1775870800,"segment":0}
{"run":20,"commit":"0200159","metric":5.5,"metrics":{"browser_tests_passed":159,"output_coherent":null,"temp_gt0_works":null,"ttft_ms":null},"status":"discard","description":"SPINLOCK: replaced Atomics.wait with busy-wait loop in rpcCall. Starves gpu-worker of CPU time in browser thread scheduling → massive regression 10.4→5.5 tok/s. Reverted.","timestamp":1775871000,"segment":0}
{"run":21,"commit":"unstaged","metric":13.4,"metrics":{"browser_tests_passed":159,"output_coherent":null,"temp_gt0_works":null,"ttft_ms":393},"status":"keep","description":"FAST-PATH DISPATCH: inline hot-path handlers (FUSED_FULL_DISPATCH, FUSED_DISPATCH_WITH_UNIFORM) in command loop, bypassing async processCommand + 13 closure allocs + switch dispatch + flushCallbacks. Playwright: 10.8→13.4 tok/s (+24%), TTFT 443→393ms (-11%).","timestamp":1775872000,"segment":0}
{"run":22,"commit":"unstaged","metric":17.5,"metrics":{"browser_tests_passed":159,"output_coherent":null,"temp_gt0_works":null,"ttft_ms":316},"status":"keep","description":"ADAPTIVE SPIN: after dispatch RPCs, gpu-worker spins 2000 iterations checking for next PENDING before falling back to Atomics.waitAsync. Avoids V8 event loop scheduling overhead (~50-100μs) for back-to-back dispatches. Playwright: 13.4→17.5 tok/s (+31%), TTFT 393→316ms (-20%).","timestamp":1775872800,"segment":0}
{"run":23,"commit":"unstaged","metric":12.7,"metrics":{"browser_tests_passed":159,"output_coherent":null,"temp_gt0_works":null,"ttft_ms":376},"status":"discard","description":"RAW SPIN READ: replaced Atomics.load with raw cmdView[STATUS_INDEX] in spin loop. V8 JIT hoists the read out of the loop, returning stale cached values → spin never catches PENDING → massive regression 17.5→12.7 tok/s. Must use Atomics.load. Reverted.","timestamp":1775873400,"segment":0}
{"run":24,"commit":"5e7c9181","metric":20,"metrics":{"browser_tests_passed":162,"output_coherent":1,"temp_gt0_works":1,"ttft_ms":461},"status":"keep","description":"Fused SDPA vector kernel: Q·K^T → softmax → ·V in single WGSL dispatch for Tq=1 decode path. Two-phase algorithm (max/sum then weighted V accumulation), workgroup=128, subgroup reductions when available. Dispatches B*H workgroups, each thread owns one output lane via if (tid < D). Pipeline cache keyed on (dtype, D, has_mask, has_subgroups). Gated by use_fallback: tq==1, d∈{64,96,128}, f32/bf16, row-contiguous, no training/logsumexp. Playwright: 17.5→20 tok/s (+14.3%), 162/163 tests pass, output coherent, temp>0 works.","timestamp":1775724676,"segment":0}
{"run":25,"commit":"fbd5c2d8","metric":22.1,"metrics":{"browser_tests_passed":162,"output_coherent":1,"temp_gt0_works":1,"ttft_ms":350,"samples":[19.3,20.6,24.8,23.6,24.1,24.0]},"status":"keep","description":"Single-pass chunked SDPA: eliminate Phase A-2 (redundant K traversal) and Phase B score recomputation by caching exp-weights in shared_red per chunk. Each chunk: (1) all threads compute weight_l and thread_sum, (2) threads tid<D accumulate V-weighted contributions using cached weights. Final sum reduction + normalization. K reads per workgroup: ~L·D² → ~2·L·D (128x reduction for D=128). 6-sample bimodal distribution: cold runs 19.3,20.6 (mean 19.95) ~= baseline 20; warm runs 23.6-24.8 (mean 24.1) — TTFT pattern 491→296 confirms system-level warmup noise unrelated to kernel change (SDPA gated to Tq=1, doesn't touch prompt phase). Neutral on cold-to-cold comparison; kept for architectural simplicity and to unblock chunk-size/V-tiling optimizations. Tests 162/163, coherent, temp>0 works.","timestamp":1775725414,"segment":0}
{"run":26,"commit":"c12fffb","metric":25.7,"metrics":{"browser_tests_passed":162,"output_coherent":1,"temp_gt0_works":1,"ttft_ms":219,"samples":[26.2,25.7,25.8,25.2,25.6]},"status":"keep","description":"Pipeline warmup at model load: run a 2-token dummy inference (maxNewTokens:2) immediately after Qwen35Model.loadFromGpuBuffers() to force WebGPU pipeline compilation for all kernels in the decode hot path. Warmup wraps in try/catch so failures don't block model readiness. Playwright 5 samples: decode mean 25.7 tok/s (20→25.7, +28.5%), TTFT mean 219ms (461→219ms, -52%). Stddev drops from ~25% to ~1.4% because cold-start pipeline compilation no longer contaminates the measurement — double win: real perf improvement AND much cleaner benchmark methodology. Tests 162/163.","timestamp":1775725937,"segment":0}
{"run":27,"commit":"6747eadd","metric":28.1,"metrics":{"browser_tests_passed":162,"output_coherent":1,"temp_gt0_works":1,"ttft_ms":220,"samples":[29.0,28.8,29.1,27.5,26.1]},"status":"keep","description":"Split-K GEMV kernel: rewrite make_gemv_kernel from 'one thread per output element' to 'one workgroup per output element, 256 threads cooperatively reduce K'. Two wins: (1) Coalesced B reads in the common b_transposed case — all 256 threads share col and iterate k, reading 256 adjacent K elements per iteration. The naive kernel had adjacent threads striding by ldb (=K), fully uncoalesced. (2) ~100x more active threads: N=3072 → 3072 wg × 256 threads = 786k threads vs old 12 wg × 256 = 3k. Workgroup reduction uses emit_subgroup_reduction when has_subgroups (pipeline key _sg suffix), fallback to emit_unrolled_reduction. Dispatch uses 2D fanout with GRID_X=65535 so lm_head (vocab ≈ 151k) fits. Playwright 5 samples: mean 28.1 ± 1.3 tok/s vs 25.7 baseline (+9.3%, +40.5% over original 20). TTFT stable ~220ms. 162/163 tests, coherent, temp>0 works.","timestamp":1775726400,"segment":0}
{"run":28,"timestamp":"2026-04-09T17:42:00+08:00","commit":"b74926a2","experiment":"multi-col GEMV kernel (COLS_PER_WG=4)","metric":29.9,"metrics":{"decode_tok_s":29.9,"browser_tests_passed":162,"output_coherent":1,"temp_gt0_works":1,"ttft_ms":212,"samples":[31.3,29.8,30.0,29.3,29.1]},"baseline":28.1,"delta_pct":6.4,"status":"keep","notes":"Amortize A-vector loads across 4 output columns. New make_gemv_multi_col_kernel with wg=128, 4 accumulators, 4 parallel reductions. Dispatcher picks multi-col when kind==GEMV && N>=16. Reduces memory traffic from 2NK to 5NK/4 (-37.5%) for lm_head/down_proj/gate_up_proj."}
{"run":29,"timestamp":"2026-04-09T18:12:00+08:00","commit":"3ce5bb47","experiment":"parameterize multi-col GEMV + add COLS_PER_WG=8 variant for N >= 512","metric":30.57,"metrics":{"decode_tok_s":30.57,"browser_tests_passed":162,"output_coherent":1,"temp_gt0_works":1,"ttft_ms":210,"samples":[31.3,30.2,30.5,30.2,31.6,31.0,29.2]},"baseline":29.9,"delta_pct":2.2,"status":"keep","notes":"Parameterize make_gemv_multi_col_kernel on cols_per_wg (emits via C++ for loops). Add kMultiCol8Threshold=512: gate/up (N=4864), down (N=896), lm_head (N=151936), q/o_proj (N=896) use 8-col; k/v_proj (N=128) stays 4-col. Memory traffic 1.25K→1.125K per col (-10%). 8-col thresh picked so workgroup count stays healthy (lowest-N case is q_proj at 112 wgs). Marginal +2.2% is within noise but consistent (6/7 samples above old mean). Pipeline prefix split gemv_mc4_/gemv_mc8_ avoids cache collisions. Comment drift cleaned up in follow-up commit 3ce5bb47. Excluded 1 cold-start outlier (27.3 tok/s, TTFT=446) caused by vite dev-server warmup."}
{"run":30,"timestamp":"2026-04-09T18:45:00+08:00","commit":"reverted","experiment":"multi-col GEMV COLS_PER_WG=16 for N >= 32768 (lm_head)","metric":29.73,"metrics":{"decode_tok_s":29.73,"browser_tests_passed":162,"output_coherent":1,"temp_gt0_works":1,"ttft_ms":210,"samples":[30.6,29.5,30.0,30.5,28.7,28.6,30.2],"cold_outlier":26.2},"baseline":30.57,"delta_pct":-2.7,"status":"discard","notes":"Added 3rd multi-col branch at N>=32768 (targets lm_head N=151936). Memory traffic per col: 17K/16 vs 9K/8 (~5.6% reduction for mc16). Shared memory cost 16*128*4=8KB fits. 8 samples: 30.6,26.2,29.5,30.0,30.5,28.7,28.6,30.2. Mean 29.29, excl cold 29.73 (vs baseline 30.57). No measurable improvement, slight regression within noise. Probable causes: (1) register pressure from 16 accumulators per thread increases occupancy limit, (2) pipeline compile cost added to warmup for one-off dispatch, (3) lm_head bandwidth already saturated by mc8, diminishing returns. Reverted matmul.cpp; restored baseline bench shows 30.4-35.4 range confirming noise level. Discarded: mc16 not worth the added shader variant."}
{"run":31,"timestamp":"2026-04-09T21:15:00+08:00","commit":"reverted","experiment":"multi-col GEMV WG_SIZE 128→256","metric":30.47,"metrics":{"decode_tok_s":30.47,"browser_tests_passed":162,"output_coherent":1,"temp_gt0_works":1,"ttft_ms":199.5,"samples":[29.3,30.6,30.2,31.3,30.4,31.0]},"baseline":30.57,"delta_pct":-0.3,"status":"discard","notes":"Doubled multi-col GEMV workgroup size from 128 to 256 to match the single-col kernel and halve per-thread K-loop iterations. Updated shared array size (128→256), @workgroup_size attr, subgroup reduction tree to match 8 subgroups (8→4→2→1 instead of 4→2→1), and non-SG reduction start stride (64→128). 6 samples: 29.3,30.6,30.2,31.3,30.4,31.0 = mean 30.47 (vs baseline 30.57). Primary metric neutral (within noise). TTFT slightly better at 199.5ms vs ~210ms (-5%, noise-adjacent). Tests 162/163, output coherent, temp>0 works — kernel correct. Hypothesis why no speedup: for K=896 in Qwen3.5, 128 threads already cover K in 7 iterations — latency-hidden loop is short enough that 4 iterations with more threads doesn't help. Dispatch overhead per workgroup also scales inversely, canceling gains. Discarded: no primary-metric improvement despite consistency with single-col."}
{"run":32,"date":"2026-04-09","experiment":"gemv_mc_n_aligned_fast_path","hypothesis":"Qwen3.5 weight shapes all have N divisible by cols_per_wg (8); has1..hasN-1 bounds guards in K-loop are pure overhead. Add n_aligned fast path that skips these guards.","changes":{"mlx/backend/webgpu/matmul.cpp":"Added bool n_aligned parameter to make_gemv_multi_col_kernel. When N % cols_per_wg == 0, skip emission of has1..hasN-1 declarations, skip if(hasI) guards on K-loop FMAs, skip guards on output stores. dispatch_matmul computes n_aligned and appends _al suffix to pipeline cache key."},"baseline":"run 29, 30.57 tok/s","results":{"samples":[31.3,31.3,31.3,31.3,31.2],"mean_tok_s":31.28,"ttft_ms":[195,192,192,193,197],"mean_ttft_ms":193.8,"browser_tests_passed":162},"delta_tok_s_pct":2.32,"delta_ttft_pct":-7.7,"verdict":"KEEP","notes":"Consistent +2.3% across 5 samples, zero variance. TTFT also improved ~8%. Guards were loop-invariant but still produced predicated branches that cost latency. Removing them unblocks K-loop FMA chain."}
{"run":33,"date":"2026-04-09","experiment":"gemv_hoisted_b_loads","hypothesis":"Explicit let bv0..bv7 declarations before FMAs will expose the loads as an independent batch for parallel issue, hiding memory latency.","changes":{"mlx/backend/webgpu/matmul.cpp":"In n_aligned fast path, emit let bvI = f32(b[...]) for all i first, then emit acc_i += a_val * bv_i for all i. Both !b_transposed and b_transposed branches."},"baseline":"run 32, 31.28 tok/s","results":{"samples":[31,31.3,28,30.4,28.7],"mean_tok_s":29.88,"browser_tests_passed":162},"delta_tok_s_pct":-4.47,"verdict":"DISCARD","notes":"Slower and more variable. The compiler already schedules loads optimally; forcing explicit temporaries increases register pressure without benefit. Reverted."}
{"run":34,"date":"2026-04-09","experiment":"gemv_subgroup_only_final_reduce","hypothesis":"Replace the 2-stage cross-subgroup tree reduction with a single subgroupAdd inside sg_id==0 block to save 1 barrier per reduction.","changes":{"mlx/backend/webgpu/matmul.cpp":"In multi-col GEMV reduction, replaced tid<2 and tid<1 stride reductions with an if (sg_id == 0u) { subgroupAdd(lane<4 ? shared[lane] : 0) } block."},"baseline":"run 32, 31.28 tok/s","results":{"samples":[27.5,25.8,26.8,27.9,29.5],"mean_tok_s":27.5,"browser_tests_passed":162,"output_coherent":0},"delta_tok_s_pct":-12.1,"verdict":"DISCARD_BROKEN","notes":"WGSL subgroup ops require workgroup-uniform control flow, not subgroup-uniform. Calling subgroupAdd inside 'if (sg_id == 0u)' is undefined behavior. Output was incoherent AND slower. Reverted."}
{"run":35,"date":"2026-04-09","experiment":"design_note_packed_bf16_weights","type":"design_note","trigger":"External reviewer feedback: bf16 stored as f32 on GPU doubles read bandwidth for memory-bound GEMV","findings":{"expansion_points":["packages/browser/src/gpu-worker.ts:263-267 (browser upload)","mlx/backend/webgpu/device.cpp:407-414 (MLX C++ upload)","wgpu_itemsize(bf16)=4","dtype_to_wgsl_safe(bf16)='f32'"],"estimated_bandwidth_savings":"37 GB/s at current decode rate"},"proposed_stages":["Side table for packed bf16 weight buffers on wgpu::device()","gpu-worker.ts upload: no expansion, 2 bytes/elem","matmul.cpp: new GEMV variant reading array<u32> and unpacking bf16 via bitcast","Extend to SDPA and vocab logits reductions"],"decision":"DEFERRED","rationale":"Multi-file refactor spanning TS/Rust FFI/C++; requires design review of loadFromGpuBuffers API change. Continuing autoresearch with smaller experiments while tracked as high-ROI follow-up."}
{"run":36,"date":"2026-04-09","experiment":"gemv_vec4_b_reads","hypothesis":"Read B as array<vec4<f32>> in n_aligned !b_transposed path to halve memory transactions (16-byte coalesced loads).","changes":{"mlx/backend/webgpu/matmul.cpp":"Added b_vec4 param to make_gemv_multi_col_kernel; emits @binding(1) var<storage, read> b: array<vec4<f32>> when active; K-loop reads let bvec_v = b[b_row_v4 + v] and unpacks .x/.y/.z/.w into cols_per_wg/4 accumulators. dispatch_matmul checks ldb%4, batch_stride_b%4, b_elem_offset%4."},"baseline":"run 32, 31.28 tok/s","results":{"warm_samples":[31.6,33.3,30.4,33.2,37.5,31.4,32.0],"mean_tok_s_incl_outlier":32.77,"mean_tok_s_excl_outlier":32.0,"clean_baseline_resample":[35.2,30.8,32.7],"clean_baseline_mean":32.9,"browser_tests_passed":162,"output_coherent":1},"delta_tok_s_pct":null,"verdict":"DISCARD_NOOP","notes":"The code gated on !b_transposed, but Qwen3.5 linear layers (lm_head, q/k/v/o_proj, gate/up/down_proj) all go through check_transpose and land on the b_transposed path where 4 output cols are stored non-contiguously (strided by ldb). vec4<f32> reads would only help if 4 cols were adjacent in memory. The +2.3% measured on first pass was within benchmark noise — a clean-baseline resample after revert shows the same 32.0-32.9 mean. Reverted matmul.cpp to run 32 state. Lesson: always verify which branch of a kernel actually fires for production shapes before trusting a marginal tok/s delta. To capture the 16-byte coalesced load benefit on the b_transposed side we'd need a different reshape: read A as vec4 (stride-K contiguous), which is the next experiment candidate but was not pursued in this session."}
{"run":"final","date":"2026-04-09","event":"autoresearch_session_closed","decode_tok_s_achieved":32.0,"ttft_ms_achieved":196,"decode_tok_s_initial":6.6,"total_speedup":"4.85x","winners_kept":[21,22,24,25,26,27,28,29,32],"losers_discarded":[20,23,30,31,33,34,36],"design_notes":[35],"status":"User satisfied with current perf (≈32 tok/s, TTFT ≈196ms, 162/163 tests, coherent output, temp>0 works). Stopping autoresearch loop."}
